{
  "profileId": "PROFILE-03",
  "version": "1.0.0",
  "documentType": "entity-definition",
  "status": "stable",
  "documentScope": "shared_master",
  "description": "エンティティ定義書。正本・旧版・移行・作業シートが混在。",
  "sheetRules": [
    {
      "ruleId": "P03-S01",
      "matchType": "exact",
      "pattern": "エンティティ定義書",
      "role": "extract",
      "skills": [
        "E2J-04"
      ],
      "outputContracts": [
        "J-30",
        "J-99"
      ],
      "priority": 200,
      "notes": "正本。"
    },
    {
      "ruleId": "P03-S02",
      "matchType": "exact",
      "pattern": "アトリビュートリスト",
      "role": "extract",
      "skills": [
        "E2J-04"
      ],
      "outputContracts": [
        "J-30",
        "J-99"
      ],
      "priority": 190,
      "notes": "属性標準。"
    },
    {
      "ruleId": "P03-S03",
      "matchType": "exact",
      "pattern": "アトリビュート辞書",
      "role": "extract",
      "skills": [
        "E2J-04"
      ],
      "outputContracts": [
        "J-30",
        "J-99"
      ],
      "priority": 190,
      "notes": "論理名/物理名対応。"
    },
    {
      "ruleId": "P03-S04",
      "matchType": "exact",
      "pattern": "select",
      "role": "extract",
      "skills": [
        "E2J-04"
      ],
      "outputContracts": [
        "J-30",
        "J-99"
      ],
      "priority": 180,
      "notes": "型・修飾子・NotNull制約。"
    },
    {
      "ruleId": "P03-S05",
      "matchType": "exact",
      "pattern": "エンティティ定義書_移行",
      "role": "reference_only",
      "skills": [
        "E2J-00",
        "E2J-04"
      ],
      "outputContracts": [
        "J-01",
        "J-30",
        "J-99"
      ],
      "priority": 120,
      "notes": "正本へ混ぜず、差分確認用。"
    },
    {
      "ruleId": "P03-S06",
      "matchType": "exact",
      "pattern": "A5SQLワーク",
      "role": "reference_only",
      "skills": [
        "E2J-00",
        "E2J-04"
      ],
      "outputContracts": [
        "J-01",
        "J-30",
        "J-99"
      ],
      "priority": 110,
      "notes": "派生・作業情報。"
    },
    {
      "ruleId": "P03-S07",
      "matchType": "regex",
      "pattern": "(^エンティティ定義書_[0-9]+$|_bk$|^古い|旧版)",
      "role": "ignore_candidate",
      "skills": [
        "E2J-00",
        "NONE"
      ],
      "outputContracts": [
        "J-01",
        "J-99"
      ],
      "priority": 300,
      "notes": "旧版・バックアップ。"
    },
    {
      "ruleId": "P03-S08",
      "matchType": "regex",
      "pattern": "^(Format|要望一覧|No152)$",
      "role": "metadata",
      "skills": [
        "E2J-00"
      ],
      "outputContracts": [
        "J-01"
      ],
      "priority": 100,
      "notes": null
    },
    {
      "ruleId": "P03-S09",
      "matchType": "regex",
      "pattern": "組織.*権限.*イメージ",
      "role": "asset",
      "skills": [
        "E2J-00",
        "ASSET"
      ],
      "outputContracts": [
        "J-01",
        "J-60"
      ],
      "priority": 100,
      "notes": "drawing/mediaを含む。"
    }
  ],
  "policies": {
    "hiddenRows": "include_and_mark",
    "formula": "display_and_formula",
    "assets": "separate_manifest",
    "canonicalSource": "無印のエンティティ定義書を正本。複数正本候補なら停止。",
    "unknownSheet": "fail",
    "profileMismatch": "fail"
  }
}
