{
  "profileId": "PROFILE-06",
  "version": "1.0.0",
  "documentType": "common-document",
  "status": "provisional",
  "documentScope": "common",
  "description": "未調査の規約・文書系向け。見出し/節単位でE2J-05へ渡す。",
  "sheetRules": [
    {
      "ruleId": "P06-S01",
      "matchType": "regex",
      "pattern": ".*",
      "role": "unknown",
      "skills": [
        "E2J-00",
        "E2J-05",
        "UNKNOWN"
      ],
      "outputContracts": [
        "J-01",
        "J-40",
        "J-99"
      ],
      "priority": 1,
      "notes": "D00を先に実行し、具体的ルールへ昇格する。"
    }
  ],
  "policies": {
    "hiddenRows": "include_and_mark",
    "formula": "display_and_formula",
    "assets": "separate_manifest",
    "canonicalSource": "D00調査後に確定。",
    "unknownSheet": "fail",
    "profileMismatch": "fail"
  }
}
