{
  "profileId": "PROFILE-05",
  "version": "1.0.0",
  "documentType": "authorization-matrix",
  "status": "stable",
  "documentScope": "shared_master",
  "description": "権限マトリクス。階層ヘッダー、非表示行、コメント、drawing/media/VML、派生SQLを含む。",
  "sheetRules": [
    {
      "ruleId": "P05-S01",
      "matchType": "exact",
      "pattern": "権限マトリクス",
      "role": "extract",
      "skills": [
        "E2J-05",
        "E2J-02"
      ],
      "outputContracts": [
        "J-40",
        "J-99"
      ],
      "priority": 200,
      "notes": "1行=画面/動作/イベント/ロール権限。"
    },
    {
      "ruleId": "P05-S02",
      "matchType": "exact",
      "pattern": "案件の参照権限",
      "role": "extract",
      "skills": [
        "E2J-05"
      ],
      "outputContracts": [
        "J-40",
        "J-99"
      ],
      "priority": 190,
      "notes": "1行=案件条件×参照先組織×タブ可否。"
    },
    {
      "ruleId": "P05-S03",
      "matchType": "exact",
      "pattern": "[補足]案件の参照権限",
      "role": "extract",
      "skills": [
        "E2J-05"
      ],
      "outputContracts": [
        "J-40",
        "J-99"
      ],
      "priority": 180,
      "notes": "補足シナリオ。正本と競合時はissue。"
    },
    {
      "ruleId": "P05-S04",
      "matchType": "exact",
      "pattern": "ヘッダ設定情報",
      "role": "metadata",
      "skills": [
        "E2J-00",
        "E2J-05"
      ],
      "outputContracts": [
        "J-01",
        "J-40"
      ],
      "priority": 100,
      "notes": "文書識別情報。"
    },
    {
      "ruleId": "P05-S05",
      "matchType": "regex",
      "pattern": "^(改訂履歴|変更履歴|説明)$",
      "role": "metadata",
      "skills": [
        "E2J-00"
      ],
      "outputContracts": [
        "J-01"
      ],
      "priority": 100,
      "notes": null
    },
    {
      "ruleId": "P05-S06",
      "matchType": "regex",
      "pattern": "^(フォーマット|フォーマット\\(ヘッダ設定有\\)|サンプル)$",
      "role": "asset",
      "skills": [
        "E2J-00",
        "ASSET"
      ],
      "outputContracts": [
        "J-01",
        "J-60"
      ],
      "priority": 100,
      "notes": "テンプレート/サンプル。業務レコードへ混ぜない。"
    },
    {
      "ruleId": "P05-S07",
      "matchType": "regex",
      "pattern": "(_bk$|_フローで分割$)",
      "role": "ignore_candidate",
      "skills": [
        "E2J-00",
        "NONE"
      ],
      "outputContracts": [
        "J-01",
        "J-99"
      ],
      "priority": 300,
      "notes": "旧版・分割作業シート。"
    }
  ],
  "policies": {
    "hiddenRows": "include_and_mark",
    "formula": "display_and_formula",
    "assets": "separate_manifest",
    "canonicalSource": "マトリクス行を正本。SQL生成列はderived。コメント/画像/VMLはJ-60。",
    "unknownSheet": "fail",
    "profileMismatch": "fail"
  }
}
