{
  "profileId": "PROFILE-04",
  "version": "1.0.0",
  "documentType": "view-definition",
  "status": "stable",
  "documentScope": "shared_master",
  "description": "VIEW定義書。検索要領内に複数VIEWブロックが縦積み。",
  "sheetRules": [
    {
      "ruleId": "P04-S01",
      "matchType": "exact",
      "pattern": "VIEW一覧",
      "role": "extract",
      "skills": [
        "E2J-04"
      ],
      "outputContracts": [
        "J-30",
        "J-99"
      ],
      "priority": 100,
      "notes": "1行=VIEW。"
    },
    {
      "ruleId": "P04-S02",
      "matchType": "exact",
      "pattern": "検索要領",
      "role": "extract",
      "skills": [
        "E2J-04"
      ],
      "outputContracts": [
        "J-30",
        "J-99"
      ],
      "priority": 100,
      "notes": "VIEW物理名/論理名を親キーとしてブロック分割。非表示行も含める。"
    }
  ],
  "policies": {
    "hiddenRows": "include_and_mark",
    "formula": "display_and_formula",
    "assets": "separate_manifest",
    "canonicalSource": "VIEW一覧の物理名と検索要領ブロック見出しを対応させる。",
    "unknownSheet": "fail",
    "profileMismatch": "fail"
  }
}
