{
  "profileId": "PROFILE-02B",
  "version": "1.0.0",
  "documentType": "batch-design",
  "status": "provisional",
  "documentScope": "feature",
  "description": "処理機能記述書と同一フォーマットという前提の暫定バッチプロファイル。",
  "sheetRules": [
    {
      "ruleId": "P02B-S01",
      "matchType": "exact",
      "pattern": "改訂履歴",
      "role": "metadata",
      "skills": [
        "E2J-00"
      ],
      "outputContracts": [
        "J-01"
      ],
      "priority": 100,
      "notes": null
    },
    {
      "ruleId": "P02B-S02",
      "matchType": "regex",
      "pattern": "^(処理機能記述|バッチ機能記述|バッチ設計)$",
      "role": "extract",
      "skills": [
        "E2J-03"
      ],
      "outputContracts": [
        "J-20",
        "J-99"
      ],
      "priority": 100,
      "notes": "実物未確認。不一致時停止。"
    },
    {
      "ruleId": "P02B-S03",
      "matchType": "exact",
      "pattern": "検索要領",
      "role": "extract",
      "skills": [
        "E2J-03",
        "E2J-04"
      ],
      "outputContracts": [
        "J-20",
        "J-30",
        "J-99"
      ],
      "priority": 90,
      "notes": null
    },
    {
      "ruleId": "P02B-S04",
      "matchType": "exact",
      "pattern": "更新要領",
      "role": "extract",
      "skills": [
        "E2J-03",
        "E2J-04"
      ],
      "outputContracts": [
        "J-20",
        "J-30",
        "J-99"
      ],
      "priority": 90,
      "notes": null
    },
    {
      "ruleId": "P02B-S05",
      "matchType": "exact",
      "pattern": "項目DB対応表",
      "role": "extract",
      "skills": [
        "E2J-04"
      ],
      "outputContracts": [
        "J-30",
        "J-99"
      ],
      "priority": 90,
      "notes": null
    }
  ],
  "policies": {
    "hiddenRows": "include_and_mark",
    "formula": "display_and_formula",
    "assets": "separate_manifest",
    "canonicalSource": "PROFILE-02との同型を仮定。バッチ固有ヘッダーを検出したらprofile_mismatchで停止。",
    "unknownSheet": "fail",
    "profileMismatch": "fail"
  }
}
